{"review_ref":"CRR-INTERMEDIATE-001","selected_candidate_id":"ARCH-FAM-C","strategies":[{"alternatives_considered":[],"architect_amendment_required":false,"builder_decisions_required":0,"class_names_affected":["smart-home__section"],"evidence_source":"architect_package","node_id":"node-root","rationale":"Approved structure is directly implementable.","strategy_id":"STR-NODE-ROOT","strategy_selected":"preserve_section_root","structure_change_required":false},{"alternatives_considered":[],"architect_amendment_required":false,"builder_decisions_required":0,"class_names_affected":["smart-home__stage--relative"],"evidence_source":"architect_package","node_id":"node-wrapper","rationale":"Approved wrapper is directly implementable.","strategy_id":"STR-NODE-WRAPPER","strategy_selected":"preserve_grouping_wrapper","structure_change_required":false}],"strategy_map_id":"ISM-INTERMEDIATE-001"}
